Perfil,Link do perfil,Perfil Antivax ou provax?,Perfil Conspiracionista?,Perfil Negacionista?,Categoria (profissão),Categoria (profissão) do perfil?,Link do post,Conteúdo do post,Post Antivax ou provax?,Post Conspiracionista?,Post Negacionista?
Joao Bittencourt 10 @titosantos6512,https://www.kwai.com/@titosantos6512,1,1,1,,,https://www.kwai.com/@titosantos6512/video/5247688096479883027,Por que não inventam vacina contra corrupção? Só assim o mundo estará livre das doenças,1,1,1
Eleandro @leo82561865,https://www.kwai.com/@leo82561865,1,1,1,Criador de conteúdo digital,,https://www.kwai.com/@tabhc330/video/5210533396640740363,"Fujam da vacina bivalente, ela contém vacina da covid cuja objetivo é eliminar 50% da população",1,1,1
Truepill @TruePill,https://www.kwai.com/@TruePill,1,0,1,Criador de conteúdo digital,,https://www.kwai.com/@aljwy933/video/5238680899638260626,Número de infartos e avc aumentando,1,1,1
🇧🇷 Jesse Oliveira B22🇧🇷 @rfuhf338,https://www.kwai.com/@rfuhf338,1,0,1,Criador de conteúdo digital,,https://www.kwai.com/@julanifelskegabriel/video/5250784317514349854,O óxido de grafeno torna o vacinado um condutor eletromagnético,1,1,0
Marcelo Souza 10 @KwaiMarcelo10,https://www.kwai.com/@KwaiMarcelo10,1,0,1,Criador de conteúdo digital,,https://www.kwai.com/@genisantos70/video/5253599067506474953,Criança morre ao ser vacinada pela covid-19,1,0,1
@emersonleitedonascimento @emerson_nascimento09,https://www.kwai.com/@emerson_nascimento09,1,1,1,Criador de conteúdo digital,,https://www.kwai.com/@ecwvv980/video/5231925451194689137,Vacinas são bombas relógio,1,1,1
@MRC @mrc505,https://www.kwai.com/@mrc505,1,1,1,Criador de conteúdo digital,,https://www.kwai.com/@hady632/video/5245717766968455110,Contaminação por grafeno,1,1,1
notíciasDR @prvkf907,"

https://www.kwai.com/@prvkf907",1,1,1,Criador de conteúdo digital,,https://www.kwai.com/@destaquenews361/video/5232488449495572028,Efeitos colaterais da vacina do HPV: vacinação proibida já ,1,0,1
,,,,,,,https://www.kwai.com/@pauloaraujo13/video/5244591827367363964,Figuras que ridicularizaram as vacinas sendo vacinados: só elas salvam,0,0,0
,,,,,,,https://www.kwai.com/@akkyy749/video/5212222246883138015,Óxido de grafeno encontrado nas vacinas ,1,1,0
,,,,,,,https://www.kwai.com/@naiaracruz1204/video/5208281552909537552,Protesto em prol das  pessoas mortas pela vacina,1,0,1
,,,,,,,https://www.kwai.com/@sxggl241/video/5236147577544567826,Reação da vacina Pfizer,1,0,0
,,,,,,,https://www.kwai.com/@verdadeescondida777/video/5215599949222447585,Crime e persiguição aos pais que não vacinaram seus filhos,1,0,1
,,,,,,,https://www.kwai.com/@reginaramos506/video/5244591869911138177,A verdade sobre a vacina: Bolsonaro tomou as ações corretas,1,0,1
,,,,,,,https://www.kwai.com/@APGO1000graus/video/5229110748840138222,Médico alerta sobre os efeitos colaterais graves da covid-19 ,1,0,1
,,,,,,,https://www.kwai.com/@sosoturna/video/5228829268789554340,USA descobre que covid-19 pode ter sido uma criação de um laboratório chinês,1,1,0
,,,,,,,https://www.kwai.com/@direitaconserv22/video/5236429095545971717,Bolsonaro tinha razão: morte por coágulo sanguíneo suspendeu o uso da vacina da covid-19 na Europa,1,0,1
,,,,,,,https://www.kwai.com/@verdadeescondida777/video/5215599949222447590,Crime e persiguição aos pais que não vacinaram seus filhos,1,0,1
,,,,,,,https://www.kwai.com/@evangelistas.do.ap/video/5257539719468232014,Mais uma morte causada pela imposição de vacinas do sistema sujo e maligno,1,0,1
,,,,,,,https://www.kwai.com/@jpqhc971/video/5217851705110332394,Mais uma vítima das vacinas da morte,1,0,1
,,,,,,,https://www.kwai.com/@LuckMG/video/5251628743475519900,Protesto no mundo todo contra as vacinas experimentais,1,0,1
,,,,,,,https://www.kwai.com/@uwecj389/video/5245154776603091377,"Não há mortes de crianças pela covid-19, mas sim pelas vacinas",1,0,1
,,,,,,,https://www.kwai.com/@dnodl552/video/5255287918490438646,Pensar fora da caixinha: as vacinas matam,1,1,1
,,,,,,,https://www.kwai.com/@030576fff/video/5242903017669729026,"Não é vacina, é experimento: elas matam",1,0,1
,,,,,,,https://www.kwai.com/@RepassedeNoticias/video/5189704250305772095,"A obrigatoriedade das vacinas é um perigo, e inconstitucional",1,0,1
,,,,,,,https://www.kwai.com/@danilodavi_86/video/5255850866127022287,Coagulação sanguínea: motivo das mortes dos vacinados contra covid-19,1,0,1
,,,,,,,https://www.kwai.com/@akemyokawa/video/5193926372431347276,"Vacinas matam, elas contêm alumínio, mercúrio, vírus mortos e fragmentos de fetos",1,1,1
,,,,,,,https://www.kwai.com/@gilvfreitas/video/5249095469806048214,Vacinas são um experimento global,1,1,1
,,,,,,,https://www.kwai.com/@uwecj389/video/5202370622764909053,Austrália entendeu o risco das vacinas e a proíbem ,1,1,1
,,,,,,,https://www.kwai.com/@MRagazza/video/5226858950079961463,Estão querendo obrigar uma vacina às crianças que podem causar altos danos,1,0,1
,,,,,,,https://www.kwai.com/@/video/5219540600340091106,As quatro maneiras de morte pelas vacinas contra covid-19: por Peter Mccullouh,1,1,1
,,,,,,,https://www.kwai.com/@Alex065/video/5234458775457052753,Tomou vacina e morreu: elas não podem ser obrigatória,1,0,1